context_precision_no_ref,faithfulness,answer_relevancy,user_input,retrieved_contexts,response
0.0,0.5,0.7543826954016085,Describe gold,"['Gold is a chemical element; it has chemical symbol Au and atomic number 79. In its pure form, it is a bright, slightly orange-yellow, dense, soft, malleable, and ductile metal. Chemically, gold is a transition metal, a group 11 element, and one of the noble metals. It is one of the least reactive chemical elements, being the second-lowest in the reactivity series. It is solid under standard conditions.']",Is there anything else you would like to know about gold?
0.9999999999,1.0,0.750256183296305,What does the document say about copper?,"['Copper\n- Description: Copper is a reddish-brown metal known for its high electrical and thermal conductivity. \nIt is one of the oldest metals used by humans.\n- Industrial Uses: opper is essential in power generation and transmission, building wiring, plumbing, and \nthe manufacturing of electronics and motors. It is also used in alloys like bronze and brass.\n- 2023 Price: 0.0098 USD/gram']","Copper is a reddish-brown metal known for its high electrical and thermal conductivity. It is one of the oldest metals used by humans. Copper is essential in power generation and transmission, building wiring, plumbing, and the manufacturing of electronics and motors. It is also used in alloys like bronze and brass. The 2023 reference price for copper is $0.0098 USD/gram."
0.9999999999,1.0,0.753679939003333,What does the PDF say about the industrial uses of copper?,"['Copper\n- Description: Copper is a reddish-brown metal known for its high electrical and thermal conductivity. \nIt is one of the oldest metals used by humans.\n- Industrial Uses: opper is essential in power generation and transmission, building wiring, plumbing, and \nthe manufacturing of electronics and motors. It is also used in alloys like bronze and brass.\n- 2023 Price: 0.0098 USD/gram']","Copper is a reddish-brown metal known for its high electrical and thermal conductivity. It is one of the oldest metals used by humans. Copper is essential in power generation and transmission, building wiring, plumbing, and the manufacturing of electronics and motors. It is also used in alloys like bronze and brass. The 2023 reference price for copper is $0.0098 USD/gram."
0.0,0.0,0.4053257965243004,Can you give me the description and price of silver from the document?,"[""Error processing PDF: no such file: 'document'""]","It seems that I need to specify the path to the local PDF document. Since it's not provided, I'll assume a default path.

Unfortunately, I don't have access to a local PDF document containing metal information. Could you please provide me with the name of the document or specify the path where the document is located?"
0.9999999999,1.0,0.6873588895298637,What does the document mention about palladium's applications?,"['Palladium\n- Description: Palladium is a rare, silvery-white metal with excellent catalytic efficiency. Like platinum, \nit belongs to the platinum group.\n- Industrial Uses: It is primarily used in catalytic converters, electronics, dentistry, and hydrogen \npurification systems. Its demand has increased due to stricter emission standards.\n- 2023 Price: 35.8252 USD/gram']","Palladium is a rare, silvery-white metal with excellent catalytic efficiency. It is primarily used in catalytic converters, electronics, dentistry, and hydrogen purification systems. Its demand has increased due to stricter emission standards. The current price of palladium is 35.8252 USD/gram."
0.9999999999,1.0,0.9281879308842659,What’s the current market price of gold?,['The latest gold price was 3452.60 USD per ounce on 2025-06-13.'],The current market price of gold is $3452.60 per ounce.
0.9999999999,1.0,0.7111849221502563,How much is silver trading at today?,['The latest silver price was 36.37 USD per ounce on 2025-06-13.'],"Silver is currently trading at around $36.37 per ounce as of June 13, 2025."
0.99999999995,0.8333333333333334,0.813201706696883,Can you check the latest price of copper and describe it?,"['The latest copper price was 4.75 USD per ounce on 2025-06-13.', 'Copper is a chemical element; it has symbol Cu and atomic number 29. It is a soft, malleable, and ductile metal with very high thermal and electrical conductivity. A freshly exposed surface of pure copper has a pinkish-orange color. Copper is used as a conductor of heat and electricity, as a building material, and as a constituent of various metal alloys, such as sterling silver used in jewelry, cupronickel used to make marine hardware and coins, and constantan used in strain gauges and thermocouples for temperature measurement.']","The current copper price is 4.75 USD per ounce. Copper is a chemical element with the symbol Cu and atomic number 29, known for its high thermal and electrical conductivity, as well as its use in various metal alloys and applications."
0.9999999999,0.75,0.856251461447981,What is platinum and what are its main characteristics?,"['Platinum is a chemical element; it has symbol Pt and atomic number 78. It is a dense, malleable, ductile, highly unreactive, precious, silverish-white transition metal. Its name originates from Spanish platina, a diminutive of plata ""silver"".']","The general encyclopedic description of platinum from Wikipedia states that it is a rare and valuable chemical element with the symbol Pt and atomic number 78. It is a dense, malleable, ductile, highly unreactive, precious, silverish-white transition metal. Its name originates from Spanish platina, a diminutive of plata ""silver""."
0.9999999999,0.3333333333333333,0.964673528737593,What's the technical description of silver,"[""Silver is a chemical element; it has symbol Ag and atomic number 47. A soft, whitish-gray, lustrous transition metal, it exhibits the highest electrical conductivity, thermal conductivity, and reflectivity of any metal. Silver is found in the Earth's crust in the pure, free elemental form, as an alloy with gold and other metals, and in minerals such as argentite and chlorargyrite. Most silver is produced as a byproduct of copper, gold, lead, and zinc refining.""]","The technical description of silver is: A soft, whitish-gray, lustrous transition metal that exhibits the highest electrical conductivity, thermal conductivity, and reflectivity of any metal."
